Плагиат;Длина документа;Цитируемость;Документ
0;35180;130; Лапин Н.И. Социальные ценности и реформы в кризисной России. Социологические исследования.  1993. № 9.  С. 17-28
0;82180;129; Кудрин А.Л., Гурвич Е.Т. Новая модель роста для российской экономики. Вопросы экономики.  2014. № 12.  С. 4-36
3618;23716;129; Панин В.Е. Синергетические принципы физической мезомеханики. Физическая мезомеханика.  2000. Т. 3. № 6.  С. 5-36
0;39515;129; Зорькин В.Д. Ценностный подход в конституционном регулировании прав и свобод. Журнал российского права.  2008. № 12 (144).  С. 3-14
0;87614;128; Барабанщиков B.А. Системная организация и развитие психики. Психологический журнал.  2003. Т. 24. № 1.  С. 29-47
0;92469;128; Капустин Б.Г. Конец транзитологии? О теоретическом осмыслении первого посткоммунистического десятилетия. Полис. Политические исследования.  2001. № 4.  С. 6-26
0;15144;128; Кирюшин В.И. Минимизация обработки почвы: перспективы и противоречия. Земледелие.  2006. № 5.  С. 12-15
0;47966;128; Холодковский К.Г. К ВОПРОСУ О ПОЛИТИЧЕСКОЙ СИСТЕМЕ СОВРЕМЕННОЙ РОССИИ. Полис. Политические исследования.  2009. № 2.  С. 7-22
376;4936;127; Оспенникова О.Г. Стратегия развития жаропрочных сплавов и сталей специального назначения, защитных и теплозащитных покрытий. Авиационные материалы и технологии.  2012. № S.  С. 19-36
1746;11149;126; Родионова И.Н., Емельянов А.С., Горохов А.А. ПОСЛЕДСТВИЯ НЕДОСТОВЕРНОСТИ СВЕДЕНИЙ ОБ АДРЕСЕ ЮРИДИЧЕСКОГО ЛИЦА. Инновационная экономика: перспективы развития и совершенствования.  2014. № 2 (5).  С. 154-158
0;35574;126; Клейнер Г. Системный ресурс экономики. Вопросы экономики.  2011. № 1.  С. 89-100
0;17214;126; Агеев Ф.Т., Фомин И.В., Мареев В.Ю., Беленков Ю.Н. Распространенность артериальной гипертонии в Европейской части Российской Федерации. Данные исследования ЭПОХА, 2003 г. Кардиология.  2004. Т. 44. № 11.  С. 50-54
0;16984;126; Цветков В.Я., Омельченко А.С. Инновация и инновационный процесс как сложная система. Качество. Инновации. Образование.  2006. № 2.  С. 10-15
0;122414;126; Мельвиль А.Ю. ОПЫТ ТЕОРЕТИКО-МЕТОДОЛОГИЧЕСКОГО СИНТЕЗА СТРУКТУРНОГО И ПРОЦЕДУРНОГО ПОДХОДОВ К ДЕМОКРАТИЧЕСКИМ ТРАНЗИТАМ. Полис. Политические исследования.  1998. № 2.  С. 6-38
0;82809;126; Федотова В.Г. Факторы ценностных изменений на Западе и в России. Вопросы философии.  2005. № 11.  С. 3-23
0;4267;126; Баранов А.А., Кучма В.Р., Сухарева Л.М. Состояние здоровья современных детей и подростков и роль медико-социальных факторов в его формировании. Вестник Российской академии медицинских наук.  2009. № 5.  С. 6-10
0;41043;125; Арато А. КОНЦЕПЦИЯ ГРАЖДАНСКОГО ОБЩЕСТВА: ВОСХОЖДЕНИЕ, УПАДОК И ВОССОЗДАНИЕ - И НАПРАВЛЕНИЯ ДЛЯ ДАЛЬНЕЙШИХ ИССЛЕДОВАНИЙ. Полис. Политические исследования.  1995. № 3.  С. 48-57
8705;10117;124; Трофимов И.А., Трофимова Л.С., Яковлева Е.П. КОРМОПРОИЗВОДСТВО В РАЗВИТИИ СЕЛЬСКОГО ХОЗЯЙСТВА РОССИИ. Адаптивное кормопроизводство.  2011. № 1.  С. 4-8
0;32130;124; Мостовая И.В., Скорик А.П. АРХЕТИПЫ И ОРИЕНТИРЫ РОССИЙСКОЙ МЕНТАЛЬНОСТИ. Полис. Политические исследования.  1995. № 4.  С. 69-76
0;47656;124; Пантин В.И., Лапкин В.В. ВОЛНЫ ПОЛИТИЧЕСКОЙ МОДЕРНИЗАЦИИ в истории России К обсуждению гипотезы. Полис. Политические исследования.  1998. № 2.  С. 39-51
0;54900;124; Мау В.А. Человеческий капитал: вызовы для России. Вопросы экономики.  2012. № 7.  С. 114-132
0;18082;124; Лиханов В.А., Чувашев А.Н., Глухов А.А., Анфилатов А.А. Улучшение эффективных и экологических показателей дизеля при работе на метаноле. Тракторы и сельхозмашины.  2007. № 4.  С. 10-13
0;11832;124; Сунцов Ю.И., Болотская Л.Л., Маслова О.В., Казаков И.В. Эпидемиология сахарного диабета и прогноз его распространенности в Российской Федерации. Сахарный диабет.  2011. № 1.  С. 15
0;73934;123; Соловьев А.И. Политическая Идеология: логика исторической эволюции. Полис. Политические исследования.  2001. № 2.  С. 5-23
0;35556;123; Голиченко О. Модернизация и реформирование инновационной стратегии России: проблемы и решения. Вопросы экономики.  2010. № 8.  С. 41-53
0;56931;123; Благов Ю.Е. Концепция корпоративной социальной ответственности и стратегическое управление. Российский журнал менеджмента.  2004. Т. 2. № 3.  С. 17-34
0;12494;123; Подвальный С.Л. МНОГОАЛЬТЕРНАТИВНЫЕ СИСТЕМЫ: ОБЗОР И КЛАССИФИКАЦИЯ. Системы управления и информационные технологии.  2012. Т. 48. № 2.  С. 4-13
0;77402;123; Клейнер Г.Б. Ресурсная теория системной организации экономики. Российский журнал менеджмента.  2011. Т. 9. № 3.  С. 3-28
11204;27577;123; Сиденко А.С. О МОДЕЛИ ПОДГОТОВКИ ШКОЛ К РЕАЛИЗАЦИИ ФГОС ВТОРОГО ПОКОЛЕНИЯ. Образование и наука.  2012. № 1.  С. 3-16
0;24155;123; Захаров В.В. Всероссийская программа исследований эпидемиологии и терапии когнитивных расстройств в пожилом возрасте (Прометей). Неврологический журнал.  2006. Т. 11. № 2.  С. 27-32
0;71278;123; Айвазян С.А. К МЕТОДОЛОГИИ ИЗМЕРЕНИЯ СИНТЕТИЧЕСКИХ КАТЕГОРИЙ КАЧЕСТВА ЖИЗНИ НАСЕЛЕНИЯ. Экономика и математические методы.  2003. Т. 39. № 2.  С. 33-53
18518;61010;123; Давыдов М.И., Аксель Е.М. ЗАБОЛЕВАЕМОСТЬ ЗЛОКАЧЕСТВЕННЫМИ НОВООБРАЗОВАНИЯМИ НАСЕЛЕНИЯ РОССИИ И СТРАН СНГ В 2006 г. Вестник РОНЦ им. Н. Н. Блохина РАМН.  2008. Т. 19. № S2.  С. 52-90
0;60270;122; Вишневский В., Дементьев В. Инновации, институты и эволюция. Вопросы экономики.  2010. № 9.  С. 41-62
0;18680;122; Козлов В.А. Некоторые аспекты проблемы цитокинов. Цитокины и воспаление.  2002. Т. 1. № 1.  С. 1-8
5789;37087;122; Голод С.И. СОЦИОЛОГО-ДЕМОГРАФИЧЕСКИЙ АНАЛИЗ СОСТОЯНИЯ И ЭВОЛЮЦИИ СЕМЬИ. Социологические исследования.  2008. № 1.  С. 40-49
0;43830;121; Ершов М. Кризис 2008 года: «момент истины» для глобальной экономики и новые возможности для России. Вопросы экономики.  2008. № 12.  С. 4-26
0;49757;121; Бузгалин А., Колганов А. ЧЕЛОВЕК, РЫНОК И КАПИТАЛ В ЭКОНОМИКЕ XXI ВЕКА. Вопросы экономики.  2006. № 3.  С. 125-141
0;37696;121; Матузов Н.И. ГРАЖДАНСКОЕ ОБЩЕСТВО: СУЩНОСТЬ И ОСНОВНЫЕ ПРИНЦИПЫ. Известия высших учебных заведений. Правоведение.  1995. № 3.  С. 83-93
0;18672;121; Бурлакова Е.Б., Конрадов А.А., Мальцева Е.Л. ДЕЙСТВИЕ СВЕРХМАЛЫХ ДОЗ БИОЛОГИЧЕСКИ АКТИВНЫХ ВЕЩЕСТВ И НИЗКОИНТЕНСИВНЫХ ФИЗИЧЕСКИХ ФАКТОРОВ. Химическая физика.  2003. Т. 22. № 2.  С. 21-40
0;50980;121; Гусев Е.И., Бойко А.Н. Рассеянный склероз: достижения десятилетия. Журнал неврологии и психиатрии им. C.C. Корсакова.  2007. Т. 107. № S4.  С. 4-13
5922;25817;121; Давыдов М.И., Аксель Е.М. ЗАБОЛЕВАЕМОСТЬ ЗЛОКАЧЕСТВЕННЫМИ НОВООБРАЗОВАНИЯМИ НАСЕЛЕНИЯ РОССИИ И СТРАН СНГ В 2007 г. Вестник РОНЦ им. Н. Н. Блохина РАМН.  2009. Т. 20. № S3.  С. 52-90
0;4207;121; Цветков В.Я. МОДЕЛЬ ГЕОДАННЫХ ДЛЯ УПРАВЛЕНИЯ ТРАНСПОРТОМ. Успехи современного естествознания.  2009. № 4.  С. 51
0;50000;120; Кочкина М.С., Затейщиков А.А., Сидоренко Б.А. Измерение жесткости артерий и ее клиническое значение. Кардиология.  2005. Т. 45. № 1.  С. 64-72
0;42288;120; Горохов Д.Б., Спектор Е.И., Глазкова М.Е. Правовой мониторинг: концепция и организация. Журнал российского права.  2007. № 5 (125).  С. 25-38
12960;61648;120; Пивоваров Ю.С. Русская власть и публичная политика. Заметки историка о причинах неудачи демократического транзита. Полис. Политические исследования.  2006. № 1.  С. 12-32
7988;192752;120; Ремпель А.А. Нанотехнологии, свойства и применение наноструктурированных материалов. Успехи химии.  2007. Т. 76. № 5.  С. 474-500
0;30278;120; Валентей С. Контринновационная среда российской экономики. Вопросы экономики.  2005. № 10.  С. 132-143
0;16950;120; Адуев Б.П., Нурмухаметов Д.Р., Фурега Р.И., Звеков А.А., Каленский А.В. ВЗРЫВЧАТОЕ РАЗЛОЖЕНИЕ ТЭНа С НАНОДОБАВКАМИ АЛЮМИНИЯ ПРИ ВОЗДЕЙСТВИИ ИМПУЛЬСНОГО ЛАЗЕРНОГО ИЗЛУЧЕНИЯ РАЗЛИЧНОЙ ДЛИНЫ ВОЛНЫ. Химическая физика.  2013. Т. 32. № 8.  С. 39
0;53394;120; Филимонов Д.А., Поройков В.В. Прогноз спектра биологической активности органических соединений. Российский химический журнал.  2006. Т. L. № 2.  С. 66-75
2973;41054;120; Степин В.С. Философия и эпоха цивилизационных перемен. Вопросы философии.  2006. № 2.  С. 16-26
0;45314;120; Меркель В., Круассан А. Формальные и неформальные институты в дефектных демократиях (I). Полис. Политические исследования.  2002. № 1.  С. 6-17
0;49285;119; Юревич А.В. Методологический либерализм в психологии. Вопросы психологии.  2001. № 5.  С. 3-18
0;20978;119; Зорькин В.Д. Конституционный Суд России в европейском правовом поле. Журнал российского права.  2005. № 3 (99).  С. 03-09
0;39707;119; Яковлев М.Ю. ЭНДОТОКСИНОВАЯ АГРЕССИЯ КАК ПРЕДБОЛЕЗНЬ ИЛИ УНИВЕРСАЛЬНЫЙ ФАКТОР ПАТОГЕНЕЗА ЗАБОЛЕВАНИЙ ЧЕЛОВЕКА И ЖИВОТНЫХ. Успехи современной биологии.  2003. Т. 123. № 1.  С. 31-40
2170;52507;119; Захарцев С.И., Сальников В.П. Правовой прогресс: философский и философско-правовой подходы. Правовое поле современной экономики.  2015. № 1.  С. 13-30
0;30358;119; Чиркин В.Е. Юридическое лицо публичного права. Журнал российского права.  2005. № 5 (101).  С. 16-26
0;71349;118; Матузов Н.И. Право на жизнь в свете российских и международных стандартов. Известия высших учебных заведений. Правоведение.  1998. № 1 (220).  С. 198-212
0;56505;118; Хаспекова Н.Б. ДИАГНОСТИЧЕСКАЯ ИНФОРМАТИВНОСТЬ МОНИТОРИРОВАНИЯ ВАРИАБЕЛЬНОСТИ РИТМА СЕРДЦА. Вестник аритмологии.  2003. № 32.  С. 15-23
0;23756;118; Лазебник Л.Б., Машарова А.А., Бордин Д.С., Васильев Ю.В., Ткаченко Е.И., Абдулхаков Р.А., Бутов М.А., Еремина Е.Ю., Зинчук Л.И., Цуканов В.В. МНОГОЦЕНТРОВОЕ ИССЛЕДОВАНИЕ «ЭПИДЕМИОЛОГИЯ ГАСТРОЭЗОФАГЕАЛЬНОЙ РЕФЛЮКСНОЙ БОЛЕЗНИ В РОССИИ» (МЭГРЕ): ПЕРВЫЕ ИТОГИ. Экспериментальная и клиническая гастроэнтерология.  2009. № 6.  С. 4-12
0;47608;118; Погосова Г.В. Признание значимости психоэмоционального стресса в качестве сердечно-сосудистого фактора риска первого порядка. Кардиология.  2007. Т. 47. № 2.  С. 65-72
0;23438;118; Лапин Н.И. ФУНКЦИОНАЛЬНО-ОРИЕНТИРУЮЩИЕ КЛАСТЕРЫ БАЗОВЫХ ЦЕННОСТЕЙ НАСЕЛЕНИЯ РОССИИ И ЕЕ РЕГИОНОВ. Социологические исследования.  2010. № 1.  С. 28-36
0;25838;118; Тихомиров Ю.А. Право и саморегулирование. Журнал российского права.  2005. № 9 (105).  С. 86-96
0;36670;118; Каплунов А.И. ОБ ОСНОВНЫХ ЧЕРТАХ И ПОНЯТИИ ГОСУДАРСТВЕННОГО ПРИНУЖДЕНИЯ. Государство и право.  2004. № 12.  С. 10-17
0;3423;118; Гранберг А.Г. Региональная экономика и региональная наука в России: десять лет спустя. Регион: Экономика и Социология.  2004. № 1.  С. 57-81
0;35632;117; Нарышкин С. Инновационная составляющая инвестиционных процессов. Вопросы экономики.  2007. № 5.  С. 52-64
0;106349;117; Сазонтова Т.Г., Архипенко Ю.В. Значение баланса прооксидантов и антиоксидантов - равнозначных участников метаболизма. Патологическая физиология и экспериментальная терапия.  2007. № 3.  С. 2-17
0;6527;117; Онищенко Г.Г. ВЛИЯНИЕ СОСТОЯНИЯ ОКРУЖАЮЩЕЙ СРЕДЫ НА ЗДОРОВЬЕ НАСЕЛЕНИЯ. НЕРЕШЕННЫЕ ПРОБЛЕМЫ И ЗАДАЧИ. Гигиена и санитария.  2003. № 1.  С. 3-10
0;3567;117; Лескин В.Н., Швецов А.Н. Общероссийские реформы и территориальное развитие. Статья 10. Трансформация идеологии и практики Российского федерализма в начале XXI века. Российский экономический журнал.  2003. № 3.  С. 25-47
0;35271;116; Оганое Р.Г., Погосова Г.В. Современные стратегии профилактики и лечения сердечно-сосудистых заболеваний. Кардиология.  2007. Т. 47. № 12.  С. 1-10
0;19693;116; Анфиногентова А., Крылатых Э. Стратегия развития АПК с учетом инновационных факторов. АПК: Экономика, управление.  2005. № 10.  С. 4-11
0;53835;116; Пчелинцев О.С. ПРОБЛЕМЫ СОЦИАЛЬНО-ЭКОНОМИЧЕСКОГО ОБОСНОВАНИЯ РЕГИОНАЛЬНОЙ ПОЛИТИКИ. Проблемы прогнозирования.  2002. № 1.  С. 1-20
0;28657;116; Сальников Н., Бурухин С. Реформирование высшей школы: концепция новой образовательной модели. Высшее образование в России.  2008. № 2.  С. 3-11
0;65780;116; Бондур В.Г. АЭРОКОСМИЧЕСКИЕ МЕТОДЫ И ТЕХНОЛОГИИ МОНИТОРИНГА НЕФТЕГАЗОНОСНЫХ ТЕРРИТОРИЙ И ОБЪЕКТОВ НЕФТЕГАЗОВОГО КОМПЛЕКСА. Исследование Земли из космоса.  2010. № 6.  С. 3-17
0;28186;116; Ушачев И. Устойчивое развитие агропродовольственного сектора: основные направления и проблемы. АПК: Экономика, управление.  2006. № 4.  С. 5-10
0;29862;116; Зимняя И.А., Земцова Е.В. Интегративный подход к оценке единой социально-профессиональной компетентности выпускников вузов. Высшее образование сегодня.  2008. № 5.  С. 14-19
0;50748;116; Ильина Т.С., Романова Ю.М., Гинцбург А.Л. Биопленки как способ существования бактерий в окружающей среде и организме хозяина: феномен, генетический контроль и системы регуляции их развития. Генетика.  2004. Т. 40. № 11.  С. 1445-1456
0;31175;116; Лапаева В.В. Проблема ограничения прав и свобод человека и гражданина в Конституции РФ (опыт доктринального осмысления). Журнал российского права.  2005. № 7 (103).  С. 13-23
0;43410;116; Кудрин А., Сергиенко О. Последствия кризиса и перспективы социально-экономического развития России. Вопросы экономики.  2011. № 3.  С. 4-19
0;22198;115; Зеер Э., Заводчиков Д. Идентификация универсальных компетенций выпускников работодателем. Высшее образование в России.  2007. № 11.  С. 46-56
5913;12670;115; Осипов А.Л., Трушина В.П. ИНТЕЛЛЕКТУАЛЬНАЯ СИСТЕМА ПРЕДСКАЗАНИЯ СВОЙСТВ ХИМИЧЕСКИХ ВЕЩЕСТВ. Science Time.  2015. № 4 (16).  С. 578-585
0;19168;115; Савиных В.П., Цветков В.Я. ГЕОДАННЫЕ КАК СИСТЕМНЫЙ ИНФОРМАЦИОННЫЙ РЕСУРС. Вестник Российской академии наук.  2014. Т. 84. № 9.  С. 826
0;58950;115; Кибрик А.А. Модус, жанр и другие параметры классификации дискурсов. Вопросы языкознания.  2009. № 2.  С. 3-21
2945;96735;115; Александров А.А., Кисляк О.А., Леонтьева И.В., Розанов В.Б. ДИАГНОСТИКА, ЛЕЧЕНИЕ И ПРОФИЛАКТИКА АРТЕРИАЛЬНОЙ ГИПЕРТЕНЗИИ У ДЕТЕЙ И ПОДРОСТКОВ. Кардиоваскулярная терапия и профилактика.  2009. Т. 8. № 4 S1.  С. 1-32
0;60375;115; Левин И.Б. ГРАЖДАНСКОЕ ОБЩЕСТВО НА ЗАПАДЕ И В РОССИИ. Полис. Политические исследования.  1996. № 5.  С. 107-119
0;16761;115; Хабибулин А.Г. Коррупция как угроза национальной безопасности: методология, проблемы и пути их решения. Журнал российского права.  2007. № 2 (122).  С. 45-50
0;124100;115; Швецов В.И. МАТЕМАТИЧЕСКОЕ МОДЕЛИРОВАНИЕ ТРАНСПОРТНЫХ ПОТОКОВ. Автоматика и телемеханика.  2003. № 11.  С. 3-46
121;2166;115; Пятаков А.П., Звездин А.К. Магнитоэлектрические материалы и мультиферроики. Успехи физических наук.  2012. Т. 182. № 6.  С. 593-620
0;29921;115; Дедов И.И., Мельниченко Г.А., Романцова Т.И. Патогенетические аспекты ожирения. Ожирение и метаболизм.  2004. № 1.  С. 3-9
0;19458;115; Гилинский Я.И. Социология девиантного поведения как специальная социологическая теория. Социологические исследования.  1991. № 4.  С. 72-78
8033;21276;114; Гринберг Р. Российская структурная политика: между неизбежностью и неизвестностью. Вопросы экономики.  2008. № 3.  С. 56-63
0;40768;114; Гуриев С., Плеханов A., Сонин К. Экономический механизм сырьевой модели развития. Вопросы экономики.  2010. № 3.  С. 4-23
0;35381;114; Мухин I.А. Снижение скорости клубочковой фильтрации - общепопуляционный маркер неблагоприятного прогноза. Терапевтический архив.  2007. Т. 79. № 6.  С. 1-10
0;32703;114; Денисов Г.И. Юридическая техника: теория и практика. Журнал российского права.  2005. № 8 (104).  С. 86-96
503;3355;114; Козырева О.А. Феноменологические особенности формирования культуры самостоятельной работы педагога. Наука. Инновации. Технологии.  2011. № 2.  С. 109-117
0;50491;113; Володин А.Г. ГРАЖДАНСКОЕ ОБЩЕСТВО И МОДЕРНИЗАЦИЯ В РОССИИ Истоки и современная проблематика. Полис. Политические исследования.  2000. № 3.  С. 104-116
0;32264;113; Хабриева Т.Я. Национальные интересы и законодательные приоритеты России. Журнал российского права.  2005. № 12 (108).  С. 19-29
0;171250;113; Гуревич А.В. Нелинейные явления в ионосфере. Успехи физических наук.  2007. Т. 177. № 11.  С. 1145-1178
30288;113811;113; Бабаджанов И.Х., Сальников М.В. ТРАНСФОРМАЦИЯ ОБЫЧАЕВ В ПРАВЕ НА ПОСТСОВЕТСКОМ ПРОСТРАНСТВЕ. Мир политики и социологии.  2015. № 1.  С. 180-197
