Плагиат;Длина документа;Цитируемость;Документ
0;34000;867; Байденко В. Компетенции в профессиональном образовании (К освоению компетентностного подхода). Высшее образование в России.  2004. № 11.  С. 3-13
0;22826;795; Пригожин И. Философия нестабильности. Вопросы философии.  1991. № 6.  С. 46-52
0;22728;779; Зеер Э., Сыманюк Э. Компетентностный подход к модернизации профессионального образования. Высшее образование в России.  2005. № 4.  С. 23-30
4439;54082;757; Баевский Р.М., Иванов Г.Г., Гаврилушкин А.П., Довгалевский П.Я., Кукушкин Ю.А., Миронова Т.Ф., Прилуцкий Д.А., Семенов А.В., Федоров В.Ф., Флейшман А.Н., Медведев М.М., Чирейкин Л.В. АНАЛИЗ ВАРИАБЕЛЬНОСТИ СЕРДЕЧНОГО РИТМА ПРИ ИСПОЛЬЗОВАНИИ РАЗЛИЧНЫХ ЭЛЕКТРОКАРДИОГРАФИЧЕСКИХ СИСТЕМ (часть 1). Вестник аритмологии.  2002. № 24.  С. 65-86
0;66695;715; Хантингтон С. СТОЛКНОВЕНИЕ ЦИВИЛИЗАЦИЙ?. Полис. Политические исследования.  1994. № 1.  С. 33-48
0;29160;501; Андреев А.Л. Компетентностная парадигма в образовании: опыт философско-методологического анализа. Педагогика.  2005. № 4.  С. 19-27
0;32359;482; Симбирцев А.С. Цитокины - новая система регуляции защитных реакций организма. Цитокины и воспаление.  2002. Т. 1. № 1.  С. 9-16
0;23893;481; Шальнова С.А., Баланова Ю.А., Константинов В.В., Тимофеева Т.Н., Иванов В.М., Капустина А.В., Деев А.Д. Артериальная гипертония: распространенность, осведомленность, прием антигипертензивных препаратов и эффективность лечения среди населения Российской Федерации. Российский кардиологический журнал.  2006. № 4 (60).  С. 45-50
0;53194;471; Алмонд Г.А., Верба С. ГРАЖДАНСКАЯ КУЛЬТУРА И СТАБИЛЬНОСТЬ ДЕМОКРАТИИ. Полис. Политические исследования.  1992. № 4.  С. 122-134
0;58370;463; Карпов А.В. Рефлексивность как психическое свойство и методика ее диагностики. Психологический журнал.  2003. Т. 24. № 5.  С. 45-57
13666;83396;432; Болдырев. Н.Н. Концептуальное пространство когнитивной лингвистики. Вопросы когнитивной лингвистики.  2004. № 1.  С. 18-36
0;102520;413; Инглхарт Р. ПОСТМОДЕРН: МЕНЯЮЩИЕСЯ ЦЕННОСТИ И ИЗМЕНЯЮЩИЕСЯ ОБЩЕСТВА. Полис. Политические исследования.  1997. № 4.  С. 6-32
0;270163;397; Губин С.П., Кокшаров Ю.А., Хомутов Г.Б., Юрков Г.Ю. Магнитные наночастицы: методы получения, строение и свойства. Успехи химии.  2005. Т. 74. № 6.  С. 539-574
0;21636;383; Симбирцев А.С. Цитокины: классификация и биологические функции. Цитокины и воспаление.  2004. Т. 3. № 2.  С. 16-22
0;77218;381; Полтерович В.М. Трансплантация экономических институтов. Экономическая наука современной России.  2001. № 3.  С. 24-50
6846;50129;360; Дерябина М. Государственно-частное партнерство: теория и практика. Вопросы экономики.  2008. № 8.  С. 61-77
0;47436;356; Матузов Н.И., Малько А.В. Правовые режимы: Вопросы теории и практики. Известия высших учебных заведений. Правоведение.  1996. № 1.  С. 16-29
0;49170;344; Степин В.С. Саморазвивающиеся системы и постнеклассическая рациональность. Вопросы философии.  2003. № 8.  С. 5-17
0;12150;342; Козырева О.А. ТЕХНОЛОГИЯ СИСТЕМНО-ПЕДАГОГИЧЕСКОГО МОДЕЛИРОВАНИЯ И КАЧЕСТВО ФОРМИРОВАНИЯ КУЛЬТУРЫ САМОСТОЯТЕЛЬНОЙ РАБОТЫ ПЕДАГОГОВ: ТЕОРЕТИЧЕСКИЙ АСПЕКТ. European Social Science Journal.  2014. № 4-1 (43).  С. 136-142
0;24685;333; Шальнова С.А., Деев А.Д., Оганов Р.Г. Факторы, влияющие на смертность от сердечно-сосудистых заболеваний в российской популяции. Кардиоваскулярная терапия и профилактика.  2005. Т. 4. № 1.  С. 4-9
0;33149;326; Глазьев С. Мировой экономический кризис как процесс смены технологических укладов. Вопросы экономики.  2009. № 3.  С. 26-38
0;28793;311; Семенов В.Е. Ценностные ориентации современной молодежи. Социологические исследования.  2007. № 4.  С. 37-43
60300;124654;298; Болдырев Н.Н. Концептуальная основа языка. Когнитивные исследования языка.  2009. № 4.  С. 25-77
0;27364;297; Демьянков В.З. Политический дискурс как предмет политологической филологии. Политическая наука.  2002. № 3.  С. 31-44
0;38247;297; Кудрин А. Мировой финансовый кризис и его влияние на Россию. Вопросы экономики.  2009. № 1.  С. 9-27
1997;81832;294; Болдырев Н.Н. ЯЗЫКОВЫЕ КАТЕГОРИИ КАК ФОРМАТ ЗНАНИЯ. Вопросы когнитивной лингвистики.  2006. № 2.  С. 5-22
0;30751;292; Афанасьев М., Мясникова Л. Мировая конкуренция и кластеризация экономики. Вопросы экономики.  2005. № 4.  С. 75-86
0;65571;290; Кузьминов Я., Радаев В., Яковлев А., Ясин Е. ИНСТИТУТЫ: ОТ ЗАИМСТВОВАНИЯ К ВЫРАЩИВАНИЮ &lti&gt(опыт российских реформ и возможности &lt/i&gtкультивирования институциональных изменений). Вопросы экономики.  2005. № 5.  С. 5-27
0;52509;288; Полтерович В. Гипотеза об инновационной паузе и стратегия модернизации. Вопросы экономики.  2009. № 6.  С. 4-23
0;73838;274; Демьянов А.В., Котов А.Ю., Симбирцев А.С. Диагностическая ценность исследования уровней цитокинов в клинической практике. Цитокины и воспаление.  2003. Т. 2. № 3.  С. 20-35
0;18173;272; Козырева О.А. ПРОДУКТИВНОСТЬ ИСПОЛЬЗОВАНИЯ ТЕХНОЛОГИИ СИСТЕМНО-ПЕДАГОГИЧЕСКОГО МОДЕЛИРОВАНИЯ В МОДЕЛИ ФОРМИРОВАНИЯ КУЛЬТУРЫ САМОСТОЯТЕЛЬНОЙ РАБОТЫ ПЕДАГОГА. European Social Science Journal.  2015. № 5.  С. 164-171
0;12795;269; Козырева О.А. СПЕЦИФИКА СОЗДАНИЯ ПЕДАГОГИЧЕСКИХ УСЛОВИЙ ВКЛЮЧЕНИЯ БУДУЩЕГО ПЕДАГОГА В НАУЧНО-ИССЛЕДОВАТЕЛЬСКУЮ РАБОТУ. Вестник Кемеровского государственного университета.  2015. № 2-3.  С. 63-67
3506;55056;267; Полтерович В. Стратегии модернизации, институты и коалиции. Вопросы экономики.  2008. № 4.  С. 4-24
0;11223;266; Коновалов С.В., Козырева О.А. ОРГАНИЗАЦИЯ ПРОДУКТИВНОЙ САМОСТОЯТЕЛЬНОЙ РАБОТЫ СТУДЕНТОВ КАК СОЦИАЛЬНО-ПРОФЕССИОНАЛЬНАЯ ПРОБЛЕМА. Профессиональное образование в России и за рубежом.  2015. № 2 (18).  С. 153-156
0;5957;265; Баранов А.А., Щеплягина Л.А., Ильин А.Г., Кучма В.Р. СОСТОЯНИЕ ЗДОРОВЬЯ ДЕТЕЙ КАК ФАКТОР НАЦИОНАЛЬНОЙ БЕЗОПАСНОСТИ. Российский педиатрический журнал.  2005. № 2.  С. 4-8
0;16004;261; Огонов Р.Г., Масленникова Г.Я. Профилактика сердечно-сосудистых заболеваний - реальный путь улучшения демографической ситуации в России. Кардиология.  2007. Т. 47. № 1.  С. 1-8
0;36697;258; Ядов В.А. СОЦИАЛЬНАЯ ИДЕНТИФИКАЦИЯ В КРИЗИСНОМ ОБЩЕСТВЕ. Социологический журнал.  1994. № 1.  С. 35-52
0;12040;247; Асмолов А.Г. СИСТЕМНОДЕЯТЕЛЬНОСТНЫЙ ПОДХОД К РАЗРАБОТКЕ СТАНДАРТОВ НОВОГО ПОКОЛЕНИЯ. Педагогика.  2009. № 4.  С. 18-22
0;87659;247; Третьяк О.А., Румянцева М.Н. СЕТЕВЫЕ ФОРМЫ МЕЖФИРМЕННОЙ КООПЕРАЦИИ: ПОДХОДЫ К ОБЪЯСНЕНИЮ ФЕНОМЕНА. Российский журнал менеджмента.  2003. Т. 1. № 2.  С. 25-50
0;33118;246; Андреев A. Знания или компетенции?. Высшее образование в России.  2005. № 2.  С. 3-11
0;15041;244; Лайков Д.Н., Устынюк Ю.А. Система квантово-химических программ «ПРИРОДА-04». Новые возможности исследования молекулярных систем с применением параллельных вычислений. Известия Академии наук. Серия химическая.  2005. № 3.  С. 804-810
13582;48853;243; Мау В. Драма 2008 года: от экономического чуда к экономическому кризису. Вопросы экономики.  2009. № 2.  С. 4-23
0;86448;238; Парфенов Л.М., Берзин Н.А., Ханчук А.И., Бадарч Г., Беличенко В.Г., Булгатов А.Н., Дриль С.И., Кириллова Г.Л., Кузьмин М.И., Ноклеберг У., Прокопьев А.В., Тимофеев В.Ф., Томуртогоо О., Янь Х. Модель формирования орогенных поясов центральной и северо-восточной азии. Тихоокеанская геология.  2003. Т. 22. № 6.  С. 7-41
114;2998;238; Асмолов А.Г. Стратегия социокультурной модернизации образования: на пути к преодолению кризиса идентичности и построению гражданского общества. Вопросы образования.  2008. № 1.  С. 65-87
4184;13124;235; Панин В.Е. Поверхностные слои нагруженных твердых тел как мезоскопический структурный уровень деформации. Физическая мезомеханика.  2001. Т. 4. № 3.  С. 5-22
0;44255;235; Сальников М.В. ГЕОПОЛИТИЧЕСКИЕ, ЭКОНОМИЧЕСКИЕ И СОЦИОКУЛЬТУРНЫЕ факторы в контексте становления и динамики развития национальной политико-правовой традиции в РОССИИ. Правовое поле современной экономики.  2012. № 11.  С. 47-66
0;51341;233; Кубрякова Е.С. Об установках когнитивной науки и актуальных проблемах когнитивной лингвистики. Вопросы когнитивной лингвистики.  2004. № 1.  С. 6-17
3562;36227;228; Фролов А.А. ГЕНЕРАЦИЯ ТЕРАГЕРЦЕВОГО ИЗЛУЧЕНИЯ ПРИ ОТРАЖЕНИИ ЛАЗЕРНОГО ИМПУЛЬСА ОТ ПЛОТНОЙ ПЛАЗМЫ. Физика плазмы.  2007. Т. 33. № 12.  С. 1107-1116
0;26894;223; Леонтьев Д.А., Шелобанова Е.В. Профессиональное самоопределение как построение образов возможного будущего. Вопросы психологии.  2001. № 1.  С. 57-65
1199;23516;222; Вербицкий А. Контекстное обучение в компетентностном подходе. Высшее образование в России.  2006. № 11.  С. 39-46
0;39562;217; Хрусталев Е.Ю. Проблемы организации и управления в наукоемких отраслях экономики России. Менеджмент в России и за рубежом.  2001. № 1.  С. 20-32
0;47820;211; Сальников М.В. ПОЛИТИКО-ПРАВОВАЯ ТРАДИЦИЯ КАК ФАКТОР, ДЕТЕРМИНИРУЮЩИЙ СПЕЦИФИКУ НАЦИОНАЛЬНОЙ ПРАВОВОЙ СИСТЕМЫ. Юридическая наука: история и современность.  2013. № 9.  С. 174-192
0;32638;209; Беляева Л.А. УРОВЕНЬ И КАЧЕСТВО ЖИЗНИ. ПРОБЛЕМЫ ИЗМЕРЕНИЯ И ИНТЕРПРЕТАЦИИ. Социологические исследования.  2009. № 1.  С. 33-42
1839;12674;208; Мухин Н.А., Моисеев В.С., Кобалава Ж.Д., Моисеев С.В., Фомин В.В. Кардиоренальные &lti&gtвзаимодействия: клиническое значение &lt/i&gtи роль &lti&gtв &lt/i&gtпатогенезе заболеваний сердечнососудистой системы и почек. Терапевтический архив.  2004. Т. 76. № 6.  С. 39-46
12765;49453;206; Сальников В.П., Сальников М.В. Правовая культура и политико-правовые традиции в контексте абсолютных ценностей. Юридическая мысль.  2014. № 4 (84).  С. 70-86
8412;29038;206; Сальников В.П. Право и свобода в качественной иерархии ценностей личности. Вестник Балтийского федерального университета им. И. Канта. Серия: Гуманитарные и общественные науки.  2006. № 9.  С. 6-15
0;3869;205; Иншаков О.В. «Ядро развития» в контексте новой теории факторов производства. Экономическая наука современной России.  2003. № 1.  С. 11-25
0;52867;203; Соловьев А.И. Политическая коммуникация: к проблеме теоретической идентификации. Полис. Политические исследования.  2002. № 3.  С. 5-18
1973;21466;200; Крупнов А.И. Системно-диспозиционный подход к изучению личности и ее свойств. Вестник Российского университета дружбы народов. Серия: Психология и педагогика.  2006. № 1.  С. 63-73
1790;46923;199; Редлих С.М., Козырева О.А. Современные методы продуктивной педагогики и проблема формирования культуры самостоятельной работы педагога. Профессиональное образование в России и за рубежом.  2011. № 1 (3).  С. 50-62
0;42986;199; Никитин М.В. Развернутые тезисы о концептах. Вопросы когнитивной лингвистики.  2004. № 1.  С. 53-64
4396;73140;196; Сальников М.В. ЗАПАДНАЯ ТРАДИЦИЯ ПРАВА: ПОЛИТИКО-ПРАВОВЫЕ ЦЕННОСТИ И ИДЕАЛЫ. Мир политики и социологии.  2013. № 10.  С. 170-191
0;65769;195; Глазьев С. О стратегии экономического развития России. Вопросы экономики.  2007. № 5.  С. 30-51
0;27879;193; Романовская В.Б. Духовность и правосознание (соотношение феноменов). Вестник Нижегородского университета им. Н.И. Лобачевского. Серия: Право.  2001. № 1.  С. 161-169
0;10197;193; Панин В.Е. Основы физической мезомеханики. Физическая мезомеханика.  1998. Т. 1. № 1.  С. 5-22
0;42706;191; Сморгунов Л.В. СЕТЕВОЙ ПОДХОД К ПОЛИТИКЕ И УПРАВЛЕНИЮ. Полис. Политические исследования.  2001. № 3.  С. 103-112
0;36890;190; Черешнев В.А., Гусев Е.Ю. Иммунология воспаления: роль цитокинов. Медицинская иммунология.  2001. Т. 3. № 3.  С. 361-368
0;66240;187; Сальников М.В. ЭВОЛЮЦИЯ ОТЕЧЕСТВЕННОЙ ПОЛИТИКО-ПРАВОВОЙ ТРАДИЦИИ: НЕКОТОРЫЕ ПРОБЛЕМЫ СООТНОШЕНИЯ СТАТИЧЕСКОГО И ДИНАМИЧЕСКОГО НАЧАЛ. Правовое поле современной экономики.  2013. № 9.  С. 62-81
8396;59479;186; Сальников М.В. Национальное и универсальное начала в политико-правовой традиции (теоретикоправовой и аксиологический анализ). Юридическая наука: история и современность.  2013. № 10.  С. 11-32
1333;35728;186; Сальников М.В. ПОЛИТИКО-ПРАВОВАЯ ТРАДИЦИЯ И ПРАВОВАЯ КУЛЬТУРА ОБЩЕСТВА: СООТНОШЕНИЕ В ТЕОРЕТИЧЕСКОМ ПРАВОВЕДЕНИИ И ЮРИДИЧЕСКОЙ ПРАКТИКЕ. Мир политики и социологии.  2013. № 9.  С. 169-186
0;10244;184; Каблов Е.Н. Химия в авиационном материаловедении. Российский химический журнал.  2010. Т. LIV. № 1.  С. 3-4
4458;26776;182; Сальников В.П., Сальников М.В. ПРАВОВАЯ КУЛЬТУРА И ПРАВОВАЯ ТРАДИЦИЯ В ИХ КАТЕГОРИАЛЬНОМ СООТНОШЕНИИ И ПОНИМАНИИ. Правовое государство: теория и практика.  2014. № 3 (37).  С. 13-19
0;15853;179; Арановская И. Подготовка специалиста как социокультурная проблема. Высшее образование в России.  2002. № 4.  С. 115-119
0;10533;179; Дорофеев А. Профессиональная компетентность как показатель качества образования. Высшее образование в России.  2005. № 4.  С. 30-33
0;56137;178; Назарчук А.В. Сетевое общество и его философское осмысление. Вопросы философии.  2008. № 7.  С. 61-75
0;178282;178; Крутяков Ю.А., Кудринский А.А., Оленин А.Ю., Лисичкин Г.В. Синтез и свойства наночастиц серебра: достижения и перспективы. Успехи химии.  2008. Т. 77. № 3.  С. 242-269
0;18820;177; Панин А.Н., Малик Н.И. Пробиотики - неотъемлемый компонент рационального кормления животных. Ветеринария.  2006. № 7.  С. 3-6
0;53967;176; Канеман Д., Тверски А. Рациональный выбор, ценности и фреймы. Психологический журнал.  2003. Т. 24. № 4.  С. 31-43
0;3973;176; Яхно Н.Н. К 10-летию Неврологического журнала. Неврологический журнал.  2006. Т. 11. № 3.  С. 4
0;7954;176; Сальников В.П. Правовая культура как фактор стабилизации современного российского общества. Вестник Нижегородского университета им. Н.И. Лобачевского. Серия: Право.  2001. № 1.  С. 187-189
0;30068;175; Сальников М.В. Традиционализм как политико-правовой феномен: методология познания и исследования. Мир политики и социологии.  2012. № 11.  С. 169-179
0;50564;174; Прусакова Л.Д., Малеванная Н.Н., Белопухов С.Л., Вакуленко В.В. Регуляторы роста растений с антистрессовыми и иммунопротекторными свойствами. Агрохимия.  2005. № 11.  С. 76-86
0;6319;174; Муздыбаев К. СТРАТЕГИЯ СОВЛАДАНИЯ С ЖИЗНЕННЫМИ ТРУДНОСТЯМИ. ТЕОРЕТИЧЕСКИЙ АНАЛИЗ. Журнал социологии и социальной антропологии.  1998. Т. I. № 2.  С. 102-112
0;5632;174; Козлов Р.С., Сивая О.В., Кречикова О.И., Иванчик Н.В., Щетинин Е.В. Динамика резистентности Streptococcus pneumoniae к антибиотикам в России за период 1999-2009 гг. (Результаты многоцентрового проспективного исследования ПеГАС). Клиническая микробиология и антимикробная химиотерапия.  2010. Т. 12. № 4.  С. 329-341
1667;50706;173; Захарцев С.И., Сальников В.П. Правосознание юриста и правовой нигилизм: современные проблемы профессиональной деформации. Юридическая наука: история и современность.  2013. № 11.  С. 11-29
0;4434;173; Фатхутдинов Р. Управление конкурентоспособностью вуза. Высшее образование в России.  2006. № 9.  С. 35-37
1302;16202;171; Сальников В.П., Сальников М.В. НАЦИОНАЛЬНО-ЭТНИЧЕСКИЕ ЦЕННОСТИ В ПРАВОВОЙ КУЛЬТУРЕ И ПОЛИТИКО-ПРАВОВЫХ ТРАДИЦИЯХ. Вестник Башкирского университета.  2014. Т. 19. № 3.  С. 1096-1100
0;7082;171; Оганов Р.Г., Лепахин Б.К., Фитилев С.Б., Левин А.М., Титарова Ю.Ю., Сычев Е.Н. Особенности диагностики и терапии стабильной стенокардии в Российской Федерации (международное исследование&lti&gt ATP &lt/i&gt- Angina Treatment Pattern). Кардиология.  2003. Т. 43. № 5.  С. 9-15
830;6311;169; Каблов Е.Н., Петрушин Н.В., Светлов И.Л., Демонис И.М. Никелевые литейные жаропрочные сплавы нового поколения. Авиационные материалы и технологии.  2012. № S.  С. 36-52
0;26060;168; Шальнова С.А., Оганов Р.Г., Деев А.Д. Оценка и управление суммарным риском сердечно-сосудистых заболеваний у населения России. Кардиоваскулярная терапия и профилактика.  2004. Т. 3. № 4.  С. 4-11
0;23085;166; Сысоев П.В., Евстигнеев М.Н. Современные учебные Интернет-ресурсы в обучении иностранному языку. Иностранные языки в школе.  2008. № 6.  С. 1-10
0;37779;165; Зубок Ю.А., Чупров В.И. МОЛОДЕЖНЫЙ ЭКСТРЕМИЗМ. СУЩНОСТЬ И ОСОБЕННОСТИ ПРОЯВЛЕНИЯ. Социологические исследования.  2008. № 5.  С. 37-46
