Плагиат;Длина документа;Цитируемость;Документ
1020;19794;79; Кудинов С.И. ПОЛИСИСТЕМНЫЙ ПОДХОД ИССЛЕДОВАНИЯ САМОРЕАЛИЗАЦИИ ЛИЧНОСТИ. Сибирский педагогический журнал.  2007. № 11.  С. 335-344
0;45731;79; Шленов Ю., Мосичева И., Шестак В. Непрерывное образование в России. Высшее образование в России.  2005. № 3.  С. 36-49
3245;9738;79; Косолапов В.М. КОРМОПРОИЗВОДСТВО В ЭКОНОМИКЕ СЕЛЬСКОГО ХОЗЯЙСТВА РОССИИ: СОСТОЯНИЕ, ПРОБЛЕМЫ, ПЕРСПЕКТИВЫ. Экономика сельскохозяйственных и перерабатывающих предприятий.  2009. № 9.  С. 6-10
0;8441;79; Грановеттер М. Экономическое действие и социальная структура: проблема укорененности. Экономическая социология.  2002. Т. 3. № 3.  С. 44-58
1726;3474;79; Зимняя И.А. Компетенция и компетентность в контексте компетентностного подхода в образовании. Иностранные языки в школе.  2012. № 6.  С. 2-10
807;10074;79; Сирак С.В., Шаповалова И.А., Пугина Ю.Н., Лолаева А.К., Афанасьева О.В., Локтионова М.В. Особенности выбора антимикробных препаратов для местного лечения воспалительных заболеваний пародонта у детей и подростков. Стоматология детского возраста и профилактика.  2008. Т. 7. № 4.  С. 61-63
686;3841;79; Соловьева А.А., Зинина О.В., Ребезов М.Б., Лакеева М.Л., Гаврилова Е.В. Актуальные биотехнологические решения в мясной промышленности. Молодой ученый.  2013. № 5.  С. 105-107
0;19280;79; Датий А.В. Характеристика ВИЧ-инфицированных, осужденных к лишению свободы (по материалам специальной переписи 2009 г.). Прикладная юридическая психология.  2014. № 1.  С. 100-107
0;62172;78; Семененко И.С., Лапкин В.В., Пантин В.И. ИДЕНТИЧНОСТЬ В СИСТЕМЕ КООРДИНАТ МИРОВОГО РАЗВИТИЯ. Полис. Политические исследования.  2010. № 3.  С. 40-59
0;137114;78; Менский М.Б. Концепция сознания в контексте квантовой механики. Успехи физических наук.  2005. Т. 175. № 4.  С. 413-435
7173;150718;78; Погребняк А.Д., Шпак А.П., Азаренков Н.А., Береснев В.М. Структура и свойства твёрдых и сверхтвёрдых нанокомпозитных покрытий. Успехи физических наук.  2009. Т. 179. № 1.  С. 35-64
0;38721;78; Ноздрачев А.Ф. Гражданин и государство: взаимоотношения в XXI веке. Журнал российского права.  2005. № 9 (105).  С. 14-26
0;27084;78; Бабкин В.А., Андреев Д.С., Заиков Г.Е., Яруллин А.Ф. КВАНТОВО-ХИМИЧЕСКИЙ РАСЧЁТ НЕКОТОРЫХ МОЛЕКУЛ ЖИДКИХ КРИСТАЛЛОВ МЕТОДОМ MNDO И AB INITIO. Вестник Казанского технологического университета.  2012. Т. 15. № 8.  С. 103-114
0;34937;78; Кожевников С.Н. Государственное принуждение: регулятивно-охранительное назначение, формы. Юридический мир.  2010. № 9.  С. 43-51
0;14718;78; Сирак С.В., Шаповалова И.А., Максимова Е.М., Пригодин С.Н. Стоматологическая заболеваемость детского населения Ставропольского края до и после внедрения программы профилактики. Стоматология детского возраста и профилактика.  2009. Т. 8. № 1.  С. 64-66
0;48285;78; Празаускас А.А. ЭТНОНАЦИОНАЛИЗМ, МНОГОНАЦИОНАЛЬНОЕ ГОСУДАРСТВО И ПРОЦЕССЫ ГЛОБАЛИЗАЦИИ. Полис. Политические исследования.  1997. № 2.  С. 95-105
0;21722;78; Сальников В.П., Казаченко В.Ф. ПРАВОВОЕ ВОСПИТАНИЕ И ПРАВОВАЯ КУЛЬТУРА В СИСТЕМЕ ОРГАНОВ МВД СССР. Известия высших учебных заведений. Правоведение.  1980. № 1.  С. 54-58
0;28518;78; Васильев В.И. Административно-территориальное устройство региона и территориальное устройство местного самоуправления. Журнал российского права.  2006. № 3 (111).  С. 3-11
1199;19238;78; Алиев Я.Л., Вихров А.А., Сальников П.П. Теневая экономика и организованная преступность в социальной системе россии. Правовое поле современной экономики.  2015. № 1.  С. 31-43
0;20086;78; Романов А., Арашуков В. Формирование агропромышленных кластеров в России. АПК: Экономика, управление.  2008. № 3.  С. 41-45
0;14280;78; Цветков В.Я. Дескриптивные и прескриптивные информационные модели. Дистанционное и виртуальное обучение.  2015. № 7 (97).  С. 48-54
1070;36952;78; Пауэлл У., Смит-Дор Л. Сети и хозяйственная жизнь. Экономическая социология.  2003. Т. 4. № 3.  С. 61-105
0;44118;78; Кинг П. Классифицирование федераций. Полис. Политические исследования.  2000. № 5.  С. 6-18
0;57663;78; Спиричев В.Б. Роль витаминов и минеральных веществ в остеогенезе и профилактике остеопатии у детей. Вопросы детской диетологии.  2003. Т. 1. № 1.  С. 39-49
0;12184;78; Величковский Б.Т., Баранов А.А., Кучма В.Р. Рост и развитие детей и подростков в России. Вестник Российской академии медицинских наук.  2004. № 1.  С. 43
36668;140416;78; Давыдов М.И., Аксель Е.М. ЗАБОЛЕВАЕМОСТЬ ЗЛОКАЧЕСТВЕННЫМИ НОВООБРАЗОВАНИЯМИ НАСЕЛЕНИЯ РОССИИ И СТРАН СНГ В 2005 г. Вестник РОНЦ им. Н. Н. Блохина РАМН.  2007. Т. 18. № S2.  С. 52-89
0;14196;78; Лобанова А.А., Будаева В.В., Сакович Г.В. Исследование биологически активных флавоноидов в экстрактах из растительного сырья. Химия растительного сырья.  2004. № 1.  С. 47-52
0;19997;78; Кригер В.Г., Каленский А.В., Звеков А.А. РЕЛАКСАЦИЯ ЭЛЕКТРОННО-ВОЗБУЖДЕННЫХ ПРОДУКТОВ ТВЕРДОФАЗНОЙ РЕАКЦИИ В КРИСТАЛЛИЧЕСКОЙ РЕШЕТКЕ. Химическая физика.  2012. Т. 31. № 1.  С. 18
0;5505;78; Мукомель В.И. Интеграция мигрантов: вызовы, политика, социальные практики. Мир России: Социология, этнология.  2011. Т. 20. № 1.  С. 34-50
0;8172;78; Датий А., Тенета Е. Характеристика ВИЧ-инфицированных осужденных в учреждениях ФСИН России. Закон и право.  2006. № 12.  С. 40-41
0;2463;78; Шинкин В.Н. ОЦЕНКА УСИЛИЙ ТРУБОФОРМОВОЧНОГО ПРЕССА SMS MEER ПРИ ИЗГИБЕ СТАЛЬНОЙ ЦИЛИНДРИЧЕСКОЙ ЗАГОТОВКИ. Актуальные проблемы гуманитарных и естественных наук.  2015. № 7-1.  С. 74-78
0;47260;78; Черноусько Ф.Л. Анализ и оптимизация движения тела, управляемого посредством подвижной внутренней массы. Прикладная математика и механика.  2006. Т. 70. № 6.  С. 915-941
0;24796;77; Межуев В.М. ИДЕЯ НАЦИОНАЛЬНОГО ГОСУДАРСТВА В ИСТОРИЧЕСКОЙ ПЕРСПЕКТИВЕ. Полис. Политические исследования.  1992. № 5-6.  С. 10-15
0;71848;77; Полищук Л., Меняшев Р. Экономическое значение социального капитала. Вопросы экономики.  2011. № 12.  С. 46-65
0;33143;77; Клинова М.В., Сидорова Е.А. Экономические санкции и их влияние на хозяйственные связи россии с европейским союзом. Вопросы экономики.  2014. № 12.  С. 67-79
0;54672;77; Захаров А.В. МАССОВОЕ ОБЩЕСТВО И КУЛЬТУРА В РОССИИ: СОЦИАЛЬНО-ТИПОЛОГИЧЕСКИЙ АНАЛИЗ. Вопросы философии.  2003. № 9.  С. 3-16
0;49057;77; Меркель В., Круассан А. Формальные и неформальные институты в дефектных демократиях (II). Полис. Политические исследования.  2002. № 2.  С. 20-30
0;12880;77; Рубин Ю. E-Learning: от экстремального обучения к упорядоченной системе. Высшее образование в России.  2007. № 11.  С. 39-45
0;13395;77; Курбанов Р.А., Бабурин С.Н. Правовое регулирование атомной энергетики в ЕС. Международное право и международные организации.  2012. № 3.  С. 98-115
3608;46697;77; Гуревич П.С. Феномен деантропологизации человека. Вопросы философии.  2009. № 3.  С. 19-31
0;11338;77; Мазур Н.А. Дисфункция эндотелия, монооксид азота и ишемическая болезнь сердца. Терапевтический архив.  2003. Т. 75. № 3.  С. 84-86
0;44759;77; Иншаков О.В., Фролов Д.П. Институциональность пространства в концепции пространственной экономики. Пространственная экономика.  2007. № 1.  С. 5-21
0;16125;77; Исмагилов Р.Ф. КАДРЫ, ИНТЕЛЛЕКТУАЛЬНАЯ АТМОСФЕРА, МАЛЫЙ И СРЕДНИЙ БИЗНЕС: АКТУАЛЬНЫЕ ПРОБЛЕМЫ СОВРЕМЕННОЙ РОССИИ. Юридическая наука: история и современность.  2013. № 9.  С. 74-81
0;23127;77; Князев С.Д. Конституционная ответственность в муниципальном праве: вопросы теории и практики. Журнал российского права.  2005. № 6 (102).  С. 81-88
0;90866;77; Головань Л.А., Тимошенко В.Ю., Кашкаров П.К. Оптические свойства нанокомпозитов на основе пористых систем. Успехи физических наук.  2007. Т. 177. № 6.  С. 619-638
10106;54449;77; Сергиенко Е.А. Системно-субъектный подход: обоснование и перспектива. Психологический журнал.  2011. Т. 32. № 1.  С. 120-132
1029;18170;77; Костюкова Е.И., Башкатова Т.А. Организационно-методические основы функционирования системы управленческого учета. Международный бухгалтерский учет.  2011. № 36.  С. 12-17
5047;40141;77; Журавлева Н.А. Динамика ценностных ориентаций молодежи в условиях социально-экономических изменений. Психологический журнал.  2006. Т. 27. № 1.  С. 35-44
0;36393;77; Мамонов В.В. ГОСУДАРСТВЕННЫЙ СУВЕРЕНИТЕТ И ТЕРРИТОРИАЛЬНАЯ ЦЕЛОСТНОСТЬ - ГЛАВНЫЕ ПРИНЦИПЫ СОВРЕМЕННОЙ РОССИЙСКОЙ ГОСУДАРСТВЕННОСТИ. Государство и право.  2004. № 4.  С. 5-12
0;20999;77; Каблов Е.Н., Гращенков Д.В., Исаева Н.В., Солнцев С.С. Перспективные высокотемпературные керамические композиционные материалы. Российский химический журнал.  2010. Т. LIV. № 1.  С. 20-24
0;26444;77; Суханов Е.А. О Концепции развития законодательства о юридических лицах. Журнал российского права.  2010. № 1 (157).  С. 5-12
0;28801;77; Зернов В. Высшее образование как ресурс инновационного развития России. Высшее образование в России.  2008. № 1.  С. 12-22
12625;22047;77; Давыдова Н.Н. Сетевое взаимодействие школ, ориентированных на инновационное развитие. Народное образование.  2012. № 1.  С. 88-94
0;2516;77; Назаренко М.А., Петров В.А., Сидорин В.В. УПРАВЛЕНИЕ ОРГАНИЗАЦИОННОЙ КУЛЬТУРОЙ И ЭТИЧЕСКИЙ КОДЕКС ВУЗА. Успехи современного естествознания.  2013. № 4.  С. 171-172
0;5726;77; Скворцов А.В. Обзор алгоритмов построения триангуляции Делоне. Вычислительные методы и программирование: новые вычислительные технологии.  2002. Т. 3. № 1.  С. 14-39
379;3840;77; Датий А.В., Трубецкой В.Ф., Селиванов Б.С. ИНТЕРНЕТ-КОНФЕРЕНЦИЯ «ПРОФИЛАКТИКА СОЦИАЛЬНО ЗНАЧИМЫХ ЗАБОЛЕВАНИЙ В УЧРЕЖДЕНИЯХ УГОЛОВНО-ИСПОЛНИТЕЛЬНОЙ СИСТЕМЫ». Прикладная юридическая психология.  2012. № 2.  С. 151-152
0;42197;76; Клавдиенко В. Стимулирование инновационной активности: мировые тенденции и Россия. Общество и экономика.  2006. № 7-8.  С. 130-147
0;17927;76; Асаул Н.А. ИНСТИТУЦИОНАЛЬНЫЙ ПОДХОД К РАЗВИТИЮ ИНВЕСТИЦИОННО-СТРОИТЕЛЬНОГО КОМПЛЕКСА. Экономическое возрождение России.  2005. № 1.  С. 37-43
0;37630;76; Байтин М.И., Петров Д.Е. Метод регулирования в системе права: виды и структура. Журнал российского права.  2006. № 2 (110).  С. 84-95
0;50430;76; Макаренко Б.И. Парламентские выборы 2003 г. как проявление кризиса партийной системы. Полис. Политические исследования.  2004. № 1.  С. 51-66
10744;67268;76; Минакир П.А., Демьяненко А.Н. Пространственная экономика: эволюция подходов и методология. Пространственная экономика.  2010. № 2.  С. 6-32
0;24871;76; Бельских И.Е. Факторы экономического роста: стратегия национального развития России. Национальные интересы: приоритеты и безопасность.  2011. № 30.  С. 15-20
0;20558;76; Рахманин Ю.А., Иванов С.И., Новиков С.М., Ревазова Ю.А., Русаков И.В. Актуальные проблемы комплексной гигиенической характеристики факторов городской среды и их воздействия на здоровье населения. Гигиена и санитария.  2007. № 5.  С. 5-7
0;11448;76; Крылатых Э.Н. АГРАРНЫЕ АСПЕКТЫ ПРИСОЕДИНЕНИЯ РОССИИ К ВТО. Экономика сельскохозяйственных и перерабатывающих предприятий.  2012. № 5.  С. 1-3
2070;15090;76; Сальников В.П., Сальников М.В., Романовская В.Б., Романовская Л.Р. НАЦИОНАЛЬНАЯ ИДЕЯ ИЛИ ПРАВОВОЕ ГОСУДАРСТВО ЧЕРЕЗ ПРИЗМУ НАЦИОНАЛЬНЫХ ИНТЕРЕСОВ. Правовое государство: теория и практика.  2015. Т. 3. № 41.  С. 16-22
551;16551;76; Добрецов Н.Л. КРУПНЕЙШИЕ МАГМАТИЧЕСКИЕ ПРОВИНЦИИ АЗИИ (250 МЛН ЛЕТ): СИБИРСКИЕ И ЭМЕЙШАНЬСКИЕ ТРАППЫ (ПЛАТОБАЗАЛЬТЫ) И АССОЦИИРУЮЩИЕ ГРАНИТОИДЫ. Геология и геофизика.  2005. Т. 46. № 9.  С. 870-890
0;62899;76; Мау В. Экономика и политика в 2011 году: глобальный кризис и поиск новой модели роста. Вопросы экономики.  2012. № 2.  С. 4-26
0;29149;76; Кармин А.С. Философия культуры в информационном обществе: проблемы и перспективы. Вопросы философии.  2006. № 2.  С. 52-60
7961;100514;76; Волков Д.Л. Показатели результатов деятельности: использование в управлении стоимостью компании. Российский журнал менеджмента.  2005. Т. 3. № 2.  С. 3-42
1101;37194;76; Сырцова А., Соколова Е.Т., Митина О.В. АДАПТАЦИЯ ОПРОСНИКА ВРЕМЕННОЙ ПЕРСПЕКТИВЫ ЛИЧНОСТИ Ф. ЗИМБАРДО. Психологический журнал.  2008. Т. 29. № 3.  С. 101-109
0;59695;76; Даймонд Л. ПРОШЛА ЛИ ТРЕТЬЯ ВОЛНА ДЕМОКРАТИЗАЦИИ?. Полис. Политические исследования.  1999. № 1.  С. 10-25
0;40811;76; Прайд В., Медведев Д.А. Феномен NBIC-конвергенции. Реальность и ожидания. Философские науки.  2008. № 1.  С. 97-116
0;21699;76; Путило Н.В. Публичные услуги: между доктринальным пониманием и практикой нормативного закрепления. Журнал российского права.  2007. № 6 (126).  С. 3-10
0;44388;76; Петров М.А. ТЕОРИЯ ЗАИНТЕРЕСОВАННЫХ СТОРОН: ПУТИ ПРАКТИЧЕСКОГО ПРИМЕНЕНИЯ. Вестник Санкт-Петербургского университета. Серия 8. Менеджмент.  2004. № 2.  С. 51-67
12391;49147;76; Сальников В.П. Образование в свете проблем глобализации, кризиса демократии, международного терроризма. Вестник Санкт-Петербургского университета МВД России.  2006. № 2.  С. 16-25
0;28945;76; Колесникова И.А. Воспитание к духовности и нравственности в эпоху глобальных перемен. Педагогика.  2008. № 9.  С. 25-33
0;45803;76; Хоружий С.С. Проблема Постчеловека, или трансформативная антропология глазами синергийной антропологии. Философские науки.  2008. № 2.  С. 10-31
0;22056;76; Иванова Е.О., Осмоловская И.М., Шалыгина И.В. Содержание образования: культурологический подход. Педагогика.  2005. № 1.  С. 13-19
1649;8939;76; Рассказова Е.И., Гордеева Т.О. Копинг-стратегии в психологии стресса: подходы, методы и перспективы исследований. Психологические исследования: электронный научный журнал.  2011. № 3 (17).  С. 4
0;2460;76; Шинкин В.Н., Барыков А.М. СИЛА ДАВЛЕНИЯ ПУАНСОНА ТРУБОФОРМОВОЧНОГО ПРЕССА SMS MEER ПРИ ИЗГИБЕ ЧАСТИЧНО ИЗОГНУТОЙ ТОЛСТОЙ СТАЛЬНОЙ ЗАГОТОВКИ. Актуальные проблемы гуманитарных и естественных наук.  2015. № 8-1.  С. 78-83
0;3182;76; Крылов М.П. РЕГИОНАЛЬНАЯ ИДЕНТИЧНОСТЬ В ИСТОРИЧЕСКОМ ЯДРЕ ЕВРОПЕЙСКОЙ РОССИИ. Социологические исследования.  2005. № 3.  С. 13-23
0;2295;76; Духнина Л.С., Лысенко Е.И., Назаренко М.А. ОСНОВНЫЕ ПРИНЦИПЫ СОЦИАЛЬНОГО ПАРТНЕРСТВА В СФЕРЕ ТРУДА И ДОВЕРИЕ К НИМ СО СТОРОНЫ РАБОТАЮЩЕЙ МОЛОДЕЖИ. Международный журнал экспериментального образования.  2013. № 4-2.  С. 174-175
2474;24414;76; Давыдова Н.Н. ОРГАНИЗАЦИОННО-УПРАВЛЕНЧЕСКАЯ МОДЕЛЬ ВЗАИМОДЕЙСТВИЯ ОБРАЗОВАТЕЛЬНЫХ УЧРЕЖДЕНИЙ КАК ФАКТОР ИННОВАЦИОННОГО РАЗВИТИЯ РЕГИОНАЛЬНОГО ОБРАЗОВАНИЯ. Образование и наука.  2010. № 8.  С. 32-41
308;7114;76; Курбанов Р.А. Структура энергетического сектора и вопросы международно-правового регулирования энергетики Североамериканских государств. Международное право.  2013. № 4.  С. 201-228
399;12750;75; Абакумов Р.Г. МЕТОДИЧЕСКИЙ ИНСТРУМЕНТАРИЙ ЭКОНОМИЧЕСКОГО ОБОСНОВАНИЯ ВЫБОРА МЕТОДА ВОСПРОИЗВОДСТВА ОСНОВНЫХ СРЕДСТВ ОРГАНИЗАЦИИ. Вестник Белгородского государственного технологического университета им. В.Г. Шухова.  2012. № 4.  С. 126-130
6302;38308;75; Третьяков Ю.Д. ПРОБЛЕМА РАЗВИТИЯ НАНОТЕХНОЛОГИЙ В РОССИИ И ЗА РУБЕЖОМ. Вестник Российской академии наук.  2007. Т. 77. № 1.  С. 3-10
0;12815;75; Таранова И.В. Теории разделения труда и размещения производительных сил в системе научного обеспечения специализации сельского хозяйства. Бизнес в законе. Экономико-юридический журнал.  2009. № 4.  С. 238-240
1310;15808;75; Бабешко В.А., Евдокимова О.В., Бабешко О.М. ДИФФЕРЕНЦИАЛЬНЫЙ МЕТОД ФАКТОРИЗАЦИИ В БЛОЧНЫХ СТРУКТУРАХ И НАНОСТРУКТУРАХ. Доклады Академии наук.  2007. Т. 415. № 5.  С. 596-599
0;31612;75; Ушачев И.Г. РАЗВИТИЕ АГРОПРОДОВОЛЬСТВЕННОГО СЕКТОРА: ОСНОВНЫЕ НАПРАВЛЕНИЯ И ПРОБЛЕМЫ. Экономика сельскохозяйственных и перерабатывающих предприятий.  2006. № 6.  С. 6-11
2670;51970;75; Громова А.Ю., Симбирцев А.С. Полиморфизм генов семейства IL-1 человека. Цитокины и воспаление.  2005. Т. 4. № 2.  С. 1-12
0;49819;75; Дубовцев В.А., Розов Н.С. ПРИРОДА РУССКОЙ ВЛАСТИ: ОТ МЕТАФОР - К КОНЦЕПЦИИ. Полис. Политические исследования.  2007. № 3.  С. 8-23
