Плагиат;Длина документа;Цитируемость;Документ
0;29480;93; Капелюшников Р., Демина Н. Влияние характеристик собственности на результаты экономической деятельности российских промышленных предприятий. Вопросы экономики.  2005. № 2.  С. 53-68
0;30558;93; Болл Т. ВЛАСТЬ. Полис. Политические исследования.  1993. № 5.  С. 36-42
0;52396;93; Соболева И. Парадоксы измерения человеческого капитала. Вопросы экономики.  2009. № 9.  С. 51-70
0;38371;93; Гуриев С., Сонин К. Экономика «ресурсного проклятия». Вопросы экономики.  2008. № 4.  С. 61-74
0;53833;93; Бауман З., Оберемко О.А. ОТ ПАЛОМНИКА К ТУРИСТУ. Социологический журнал.  1995. № 4.  С. 133-154
0;24615;93; Мамедов М.Н., Оганов Р.Г. Эпидемиологические аспекты метаболического синдрома. Кардиология.  2004. Т. 44. № 9.  С. 4-8
0;9049;93; Мухин Н.А., Моисеев В.С. КАРДИОРЕНАЛЬНЫЕ СООТНОШЕНИЯ И РИСК СЕРДЕЧНО-СОСУДИСТЫХ ЗАБОЛЕВАНИЙ. Вестник Российской академии медицинских наук.  2003. № 11.  С. 50-56
10281;38572;93; Труфанова Е.О. Человек в лабиринте идентичностей. Вопросы философии.  2010. № 2.  С. 13-22
0;15812;93; Воеводин В., Жуматий С., Соболев С., Антонов А., Брызгалов П., Никитенко Д., Стефанов К., Воеводин В. Практика суперкомпьютера «Ломоносов». Открытые системы. СУБД.  2012. № 7.  С. 36
1351;23098;93; Шальнова С.А., Деев А.Д. Характеристика пациентов высокого риска. Результаты эпидемиологической части научно-образовательной программы ОСКАР. Кардиоваскулярная терапия и профилактика.  2006. Т. 5. № 5.  С. 58-63
0;30313;92; Зеер Э.Ф. КОМПЕТЕНТНОСТНЫЙ ПОДХОД К ОБРАЗОВАНИЮ. Образование и наука.  2005. № 3.  С. 27-40
0;90487;92; Лачинов А.Н., Воробьева Н.В. Электроника тонких слоев широкозонных полимеров. Успехи физических наук.  2006. Т. 176. № 12.  С. 1249-1266
0;11460;92; Розенберг И.Н., Цветков В.Я. Среда поддержки интеллектуальных систем. Транспорт Российской Федерации.  2011. № 6 (37).  С. 63-65
0;79992;92; Панарин А.С. Постмодернизм и глобализация: проект освобождения собственников от социальных и национальных обязательств. Вопросы философии.  2003. № 6.  С. 16-36
0;18327;92; Зализняк А.А. Феномен многозначности и способы его описания. Вопросы языкознания.  2004. № 2.  С. 20-45
0;47376;92; Овсиенко Ю.В., Бизяркина Е.Н., Сухова Н.Н. УСТОЙЧИВОЕ РАЗВИТИЕ: КОНЦЕПЦИЯ И СТРАТЕГИЧЕСКИЕ ОРИЕНТИРЫ. Экономика и математические методы.  2007. Т. 43. № 4.  С. 23-33
0;50737;92; Нерсесянц B.С. Процессы универсализации права и государства в глобализирующемся мире. Государство и право.  2005. № 5.  С. 38-47
0;56717;92; Авакьян С.А. Пробелы и дефекты в конституционном праве и пути их устранения. Конституционное и муниципальное право.  2007. № 8.  С. 3-12
0;50548;92; Губанов С. Политика нового этапа: цель и средства. Экономист.  2006. № 11.  С. 3-16
0;11230;92; Цветков В.Я., Оболяева Н.М. Использование коррелятивного подхода для управления персоналом учебного заведения. Дистанционное и виртуальное обучение.  2011. № 8.  С. 4-9
0;35431;92; Кокотов А.Н. Конституционное право в российском праве: Понятие, назначение и структура. Известия высших учебных заведений. Правоведение.  1998. № 1 (220).  С. 15-22
12604;13716;92; Рагулина Ю.В. о КОНКУРЕНТОСПОСОБНОСТИ ОТЕЧЕСТВЕННОЙ ЭКОНОМИКИ. Научное обозрение.  2011. № 5.  С. 486-491
0;51091;92; Данилов Д.С. Комплаенс в медицине и методы его оптимизации (клинические, психологические и психотерапевтические аспекты). Психиатрия и психофармакотерапия.  2008. Т. 10. № 1.  С. 13-20
0;18128;92; Ушачев И. Роль и место сельского хозяйства в экономике России. АПК: Экономика, управление.  2005. № 5.  С. 24-32
13563;38151;92; Козырева О.А. Моделирование как средство формирования культуры самостоятельной работы. Профессиональное образование в России и за рубежом.  2010. № 1 (2).  С. 101-110
0;2020;92; Федотова Н.Н. Кризис идентичности в условиях глобализации. Человек.  2003. № 6.  С. 50-58
375;4848;92; Абакумов Р.Г. СУЩНОСТНЫЕ АСПЕКТЫ ЦИКЛА ВОСПРОИЗВОДСТВА ОСНОВНЫХ СРЕДСТВ ОРГАНИЗАЦИИ. Вестник Белгородского государственного технологического университета им. В.Г. Шухова.  2014. № 4.  С. 116-117
1287;3545;92; Сысоев П.В. Информатизация языкового образования: основные направления и перспективы. Иностранные языки в школе.  2012. № 2.  С. 2-9
0;2625;92; Стародубов В.И. СОХРАНЕНИЕ ЗДОРОВЬЯ РАБОТАЮЩЕГО НАСЕЛЕНИЯ - ОДНА ИЗ ВАЖНЕЙШИХ ЗАДАЧ ЗДРАВООХРАНЕНИЯ. Медицина труда и промышленная экология.  2005. № 1.  С. 1-7
0;56324;91; Мау В. Экономическая политика 2006 года: на пути к инвестиционному росту. Вопросы экономики.  2007. № 2.  С. 4-25
2270;14711;91; Говорский А.Э., Копылов М.В., Кравец О.Я. ОСОБЕННОСТИ СКВОЗНОГО ЦИКЛА МОДЕЛИРОВАНИЯ И ПРОЕКТИРОВАНИЯ МНОГОЗВЕННОЙ КЛИЕНТ-СЕРВЕРНОЙ СИСТЕМЫ. Системы управления и информационные технологии.  2010. Т. 39. № 1.  С. 27-32
0;48531;91; Горбунова И.Б. Феномен музыкально-компьютерных технологий как новая образовательная творческая среда. Известия Российского государственного педагогического университета им. А.И. Герцена.  2004. Т. 4. № 9.  С. 123-138
0;29147;91; Суслина З.А., Варакин Ю.Я. Эпидемиологические аспекты изучения инсульта. Время подводить итоги. Анналы клинической и экспериментальной неврологии.  2007. Т. 1. № 2.  С. 22-28
2038;31781;91; Нарышкин С.Е., Хабриева Т.Я. Административная реформа в России: некоторые итоги и задачи юридической науки. Журнал российского права.  2006. № 11 (119).  С. 3-13
0;42300;91; Маккиндер Х.Д. ГЕОГРАФИЧЕСКАЯ ОСЬ ИСТОРИИ. Полис. Политические исследования.  1995. № 4.  С. 162-169
0;258400;91; Ярославцев А.Б., Никоненко В.В., Заболоцкий В.И. Ионный перенос в мембранных и ионообменных материалах. Успехи химии.  2003. Т. 72. № 5.  С. 438-470
0;63957;91; Ходжсон Д. Что такое институты?. Вопросы экономики.  2007. № 8.  С. 28-48
0;55117;91; Рубин Ю. Теория конкуренции и задачи повышения конкурентоспособности российского образования. Высшее образование в России.  2007. № 1.  С. 26-43
12993;72832;91; Мареев В.Ю., Агеев Ф.Т., Арутюнов Г.П., Коротеев А.В., Ревишвили А.Ш. Национальные Рекомендации ВНОК И ОССН по диагностике и лечению ХСН (второй пересмотр). Журнал сердечная недостаточность.  2007. Т. 8. № 1.  С. 4-41
0;19649;91; Ахметова Д., Гурье Л. Преподаватель вуза и инновационные технологии. Высшее образование в России.  2001. № 4.  С. 138-144
5492;38295;91; Бельских И.Е. Институциональные основы рекламы и паблик рилейшнз фирмы в современной экономике. Экономический анализ: теория и практика.  2013. № 36 (339).  С. 16-24
0;76050;91; Баранов А.Н. О ТИПАХ СОЧЕТАЕМОСТИ МЕТАФОРИЧЕСКИХ МОДЕЛЕЙ*. Вопросы языкознания.  2003. № 2.  С. 73-94
0;49151;91; Лапин Н.И. Социокультурные факторы российской стагнации и модернизации. Социологические исследования.  2011. № 9.  С. 3-18
0;49878;91; Кравченко И.И. Политические и другие социальные ценности. Вопросы философии.  2005. № 2.  С. 3-16
0;42956;91; Витрук Н. Правовые позиции Конституционного Суда Российской Федерации: понятие, природа, юридическая сила и значение. Сравнительное конституционное обозрение.  1999. № 3.  С. 95-102
0;9243;91; Увайсов Р.И., Увайсов С.У., Иванов И.А. Обеспечение контролепригодности радиоэлектронных средств в рамках CALS-технологий. Качество. Инновации. Образование.  2011. № 1 (68).  С. 43-47
0;8024;91; Грановеттер М. Сила слабых связей. Экономическая социология.  2009. Т. 10. № 4.  С. 31-50
123;4689;91; Псахье С.Г., Остермайер Г.П., Дмитриев А.И., Шилько Е.В., Смолин А.Ю., Коростелев С.Ю. Метод подвижных клеточных автоматов как новое направление дискретной вычислительной механики. I. Теоретическое описание. Физическая мезомеханика.  2000. Т. 3. № 2.  С. 5-13
1137;2880;91; Куликов В.В., Роик В.Д. Социальная политика как приоритет и приоритеты социальной политики. Российский экономический журнал.  2005. № 1.  С. 3-17
12615;48988;90; Болдырев Н.Н., Куликов В.Г. О диалектном концепте в когнитивной системе языка. Известия Российской академии наук. Серия литературы и языка.  2006. Т. 65. № 3.  С. 3-13
0;11525;90; Шинкин В.Н., Барыков А.М. Гибка стального листа на трубоформовочном прессе при производстве труб большого диаметра. Сталь.  2015. № 4.  С. 38-42
0;51195;90; Знаков В.В. Самопонимание субъекта как когнитивная и экзистенциальная проблема. Психологический журнал.  2005. Т. 26. № 1.  С. 18-28
0;57379;90; Ивантер В.В., Комков Н.И. Перспективы и условия инновационно-технологического развития экономики России. Проблемы прогнозирования.  2007. № 3.  С. 3-20
0;31255;90; Хабриева Т.Я. Формирование правовых основ антикоррупционной экспертизы нормативных правовых актов. Журнал российского права.  2009. № 10 (154).  С. 5-13
0;26368;90; Борисова М.В. ПСИХОЛОГИЧЕСКИЕ ДЕТЕРМИНАНТЫ ФЕНОМЕНА ЭМОЦИОНАЛЬНОГО ВЫГОРАНИЯ У ПЕДАГОГОВ. Вопросы психологии.  2005. № 2.  С. 94-104
0;41149;90; Дедов И.И. Сахарный диабет: развитие технологий в диагностике, лечении и профилактике. Сахарный диабет.  2010. № 3.  С. 6-13
0;18905;90; Говорский А.Э., Корчагин А.С., Кравец О.Я. ПАРАМЕТРИЧЕСКИЙ СИНТЕЗ ГЕТЕРОГЕННОЙ ИНТЕГРАЛЬНОЙ КОРПОРАТИВНОЙ ИНФОРМАЦИОННО-УПРАВЛЯЮЩЕЙ СИСТЕМЫ. Системы управления и информационные технологии.  2008. Т. 33. № 3.1.  С. 128-134
7263;155737;90; Волков В.В., Мчедлишвили Б.В., Ролдугин В.И., Иванчев С.С., Ярославцев А.Б. Мембраны и нанотехнологии. Российские нанотехнологии.  2008. Т. 3. № 11-12.  С. 67-101
0;18836;90; Оганов Р.Г., Концевая А.В., Калинина А.М. Экономический ущерб от сердечно-сосудистых заболеваний в Российской Федерации. Кардиоваскулярная терапия и профилактика.  2011. Т. 10. № 4.  С. 4-9
0;38963;90; Федорович В.О. Состав и структура организационно-экономического механизма управления собственностью крупных промышленных корпоративных образований. Сибирская финансовая школа.  2006. № 2 (35).  С. 45-54
0;14468;90; Тихомиров Ю.А., Рахманина Т.Н., Хабибулин А.Г. Закон о нормативных правовых актах - актуальная повестка дня. Журнал российского права.  2006. № 5 (113).  С. 88-93
0;53020;90; Медведева Е.Н., Бабкин В.А., Остроухова Л.А. Арабиногалактан лиственницы - свойства и перспективы использования (Обзор). Химия растительного сырья.  2003. № 1.  С. 27-37
0;33903;90; Кубрякова Е.С. В ПОИСКАХ СУЩНОСТИ ЯЗЫКА. Вопросы когнитивной лингвистики.  2009. № 1.  С. 5-12
272;10261;89; Редлих С.М., Козырева О.А. Математические и статистические методы в технологии диагностики сформированности культуры самостоятельной работы педагога. Ученые записки Забайкальского государственного университета. Серия: Профессиональное образование, теория и методика обучения.  2011. № 6.  С. 40-44
492;11620;89; Редлих С.М., Козырева О.А. Система принципов формирования культуры самостоятельной работы педагога как механизм реализации условий продуктивного педагогического взаимодействия. Профессиональное образование в России и за рубежом.  2012. № 1 (5).  С. 27-29
0;46392;89; Нартова-Бочавер C.К. Понятие психологическое пространство личности: обоснование и прикладное значение. Психологический журнал.  2003. Т. 24. № 6.  С. 27-36
0;37953;89; Шаститко А., Афонцев С., Плаксин С. Структурные альтернативы социально-экономического развития России. Вопросы экономики.  2008. № 1.  С. 71-85
0;21244;89; Крылатых Э.Н. ПРОГНОЗ РАЗВИТИЯ АГРОПРОДОВОЛЬСТВЕННОГО СЕКТОРА РОССИИ ДО 2030 ГОДА. Экономика сельскохозяйственных и перерабатывающих предприятий.  2006. № 9.  С. 8-12
0;88446;89; Леонтьев Д.А. НОВЫЕ ОРИЕНТИРЫ ПОНИМАНИЯ ЛИЧНОСТИ В ПСИХОЛОГИИ: ОТ НЕОБХОДИМОГО К ВОЗМОЖНОМУ. Вопросы психологии.  2011. № 1.  С. 3-27
0;41801;89; Сартори Д. ВЕРТИКАЛЬНАЯ ДЕМОКРАТИЯ. Полис. Политические исследования.  1993. № 2.  С. 80-89
0;19796;89; Кубанова А.А., Лесная И.Н., Kubanov A.A., Мелехина Л.Е., Каспирович М.А. АНАЛИЗ ЭПИДЕМИОЛОГИЧЕСКОЙ СИТУАЦИИ и ДИНАМИКА ЗАБОЛЕВАЕМОСТИ ИНФЕКЦИЯМИ, ПЕРЕДАВАЕМЫМИ ПОЛОВЫМ ПУТЕМ, и ДЕРМАТОЗАМИ на ТЕРРИТОРИИ РОССИЙСКОЙ ФЕДЕРАЦИИ. Вестник дерматологии и венерологии.  2010. № 5.  С. 4-21
6600;38783;89; Локшина А.Б., Захаров В.В. ЛЕГКИЕ И УМЕРЕННЫЕ КОГНИТИВНЫЕ РАССТРОЙСТВА ПРИ ДИСЦИРКУЛЯТОРНОЙ ЭНЦЕФАЛОПАТИИ. Неврологический журнал.  2006. Т. 11. № S1.  С. 57-64
0;13870;89; Калашников В., Амерханов Х., Левахин В. МЯСНОЕ СКОТОВОДСТВО: СОСТОЯНИЕ, ПРОБЛЕМЫ И ПЕРСПЕКТИВЫ РАЗВИТИЯ. Молочное и мясное скотоводство.  2010. № 1.  С. 2-5
0;13720;89; Рязанцев И., Еременко Н. Проблемы и противоречия оборота земель сельскохозяйственного назначения на региональном уровне. Предпринимательство.  2009. № 4.  С. 149-153
0;34038;89; Журавлев А.Л. Коллективный субъект: основные признаки, уровни и психологические типы. Психологический журнал.  2009. Т. 30. № 5.  С. 72-80
0;43512;89; Перегудов С.П. ПОЛИТИЧЕСКОЕ ПРЕДСТАВИТЕЛЬСТВО ИНТЕРЕСОВ: ОПЫТ ЗАПАДА И ПРОБЛЕМЫ РОССИИ. Полис. Политические исследования.  1993. № 4.  С. 115-124
0;168617;89; Валиев К.А. Квантовые компьютеры и квантовые вычисления. Успехи физических наук.  2005. Т. 175. № 1.  С. 3-39
0;87464;89; Агранович В.М., Гартштейн Ю.Н. Пространственная дисперсия и отрицательное преломление света. Успехи физических наук.  2006. Т. 176. № 10.  С. 1051-1068
0;14065;89; Авилова И.П., Рыкова М.А., Хай Д.З. МОДИФИКАЦИЯ ПОКАЗАТЕЛЕЙ ЭКОНОМИЧЕСКОЙ ЭФФЕКТИВНОСТИ ИНВЕСТИЦИОННО-СТРОИТЕЛЬНОГО ПРОЕКТА С ИСПОЛЬЗОВАНИЕМ ПРОФИЛЕЙ РИСКА НЕПОЛУЧЕНИЯ ДОХОДОВ ПРОЕКТА. Вестник Белгородского государственного технологического университета им. В.Г. Шухова.  2014. № 4.  С. 133-137
0;2162;89; Хасанов Р.Х. Синергетический эффект кластера. Проблемы современной экономики.  2009. № 3.  С. 284-288
863;6149;89; Соболев В.С., Степанов С.А. Концепция, модель и критерии эффективности внутривузовской системы управления качеством высшего профессионального образования. Университетское управление: практика и анализ.  2004. № 2.  С. 102-110
0;43315;88; Хуторской А.В. Личностная ориентация образования как педагогическая инновация. Школьные технологии.  2006. № 1.  С. 3-12
0;23384;88; Беспахотный Г. Новые механизмы приоритетного развития сельского хозяйства. Экономист.  2008. № 7.  С. 90-96
0;23940;88; Чистякова С.Н. Проблема самоопределения старшеклассников при выборе профиля обучения. Педагогика.  2005. № 1.  С. 19-26
0;74213;88; Рыбаков С.Е. ЭТНИЧНОСТЬ И ЭТНОС. Этнографическое обозрение.  2003. № 3.  С. 3-24
2118;51014;88; Глазьев С. Перспективы российской экономики в условиях глобальной конкуренции. Экономист.  2007. № 5.  С. 3-16
0;26357;88; Витковский Ю.А., Кузник Б.И., Солпов А.В. ПАТОГЕНЕТИЧЕСКОЕ ЗНАЧЕНИЕ ЛИМФОЦИТАРНО-ТРОМБОЦИТАРНОЙ АДГЕЗИИ. Медицинская иммунология.  2006. Т. 8. № 5-6.  С. 745-753
0;26484;88; Чебышев Н., Каган В. Высшая школа XXI века: проблема качества. Высшее образование в России.  2000. № 1.  С. 19-26
7130;12781;88; Захарцев С.И. КОРРУПЦИЯ И ДЕНЬГИ: К ВОПРОСУ ПРИМЕНЕНИЯ ОПЕРАТИВНО-РОЗЫСКНЫХ МЕРОПРИЯТИЙ. Юридическая наука: история и современность.  2013. № 10.  С. 137-141
0;3302;88; Оганов Р.Г. Профилактика сердечно-сосудистых заболеваний в России: успехи, неудачи, перспективы. Терапевтический архив.  2004. Т. 76. № 6.  С. 22-24
0;9129;88; Каблов Е.Н., Оспенникова О.Г., Базылева О.А. Материалы для высокотеплонагруженных деталей газотурбинных двигателей. Вестник Московского государственного технического университета им. Н.Э. Баумана. Серия: Машиностроение.  2011. № SP2.  С. 13-19
0;11765;87; Ушачев И.Г. ЭКОНОМИЧЕСКИЙ РОСТ И КОНКУРЕНТОСПОСОБНОСТЬ СЕЛЬСКОГО ХОЗЯЙСТВА РОССИИ. Экономика сельскохозяйственных и перерабатывающих предприятий.  2009. № 3.  С. 1-9
0;20701;87; Савиных В.П., Соловьёв И.В., Цветков В.Я. РАЗВИТИЕ НАЦИОНАЛЬНОЙ ИНФРАСТРУКТУРЫ ПРОСТРАНСТВЕННЫХ ДАННЫХ НА ОСНОВЕ РАЗВИТИЯ КАРТОГРАФО-ГЕОДЕЗИЧЕСКОГО ФОНДА РОССИЙСКОЙ ФЕДЕРАЦИИ. Известия высших учебных заведений. Геодезия и аэрофотосъемка.  2011. № 5.  С. 85-90
